21:44:12.428767 IP 134.122.35.207.22 > 64.231.199.91.59623: Flags [P.], seq 374068:374224, ack 181, win 501, length 156
21:44:12.428900 IP 134.122.35.207.22 > 64.231.199.91.59623: Flags [P.], seq 374224:374380, ack 181, win 501, length 156
21:44:12.429017 IP 134.122.35.207.22 > 64.231.199.91.59623: Flags [P.], seq 374380:374536, ack 181, win 501, length 156
21:44:12.429143 IP 134.122.35.207.22 > 64.231.199.91.59623: Flags [P.], seq 374536:374692, ack 181, win 501, length 156
21:44:12.429258 IP 134.122.35.207.22 > 64.231.199.91.59623: Flags [P.], seq 374692:374848, ack 181, win 501, length 156
21:44:12.429377 IP 134.122.35.207.22 > 64.231.199.91.59623: Flags [P.], seq 374848:375004, ack 181, win 501, length 156
21:44:12.429493 IP 64.231.199.91.59623 > 134.122.35.207.22: Flags [.], ack 363772, win 6290, length 0
21:44:12.429577 IP 134.122.35.207.22 > 64.231.199.91.59623: Flags [P.], seq 375004:375160, ack 181, win 501, length 156
21:44:12.429691 IP 134.122.35.207.22 > 64.231.199.91.59623: Flags [P.], seq 375160:375300, ack 181, win 501, length 140
21:44:12.429800 IP 134.122.35.207.22 > 64.231.199.91.59623: Flags [P.], seq 375300:375456, ack 181, win 501, length 156
21:44:12.429874 IP 134.122.35.207.22 > 64.231.199.91.59623: Flags [P.], seq 375456:375612, ack 181, win 501, length 156
21:44:12.430000 IP 134.122.35.207.22 > 64.231.199.91.59623: Flags [P.], seq 375612:375888, ack 181, win 501, length 276
21:44:12.430132 IP 134.122.35.207.22 > 64.231.199.91.59623: Flags [P.], seq 375888:376044, ack 181, win 501, length 156
21:44:12.430247 IP 134.122.35.207.22 > 64.231.199.91.59623: Flags [P.], seq 376044:376200, ack 181, win 501, length 156
21:44:12.430375 IP 134.122.35.207.22 > 64.231.199.91.59623: Flags [P.], seq 376200:376356, ack 181, win 501, length 156
21:44:12.430496 IP 134.122.35.207.22 > 64.231.199.91.59623: Flags [P.], seq 376356:376512, ack 181, win 501, length 156
21:44:12.430610 IP 134.122.35.207.22 > 64.231.199.91.59623: Flags [P.], seq 376512:376668, ack 181, win 501, length 156
21:44:12.430731 IP 134.122.35.207.22 > 64.231.199.91.59623: Flags [P.], seq 376668:376824, ack 181, win 501, length 156
21:44:12.430845 IP 134.122.35.207.22 > 64.231.199.91.59623: Flags [P.], seq 376824:376980, ack 181, win 501, length 156
21:44:12.430959 IP 134.122.35.207.22 > 64.231.199.91.59623: Flags [P.], seq 376980:377136, ack 181, win 501, length 156
21:44:12.431141 IP 134.122.35.207.22 > 64.231.199.91.59623: Flags [P.], seq 377136:377292, ack 181, win 501, length 156
21:44:12.431291 IP 134.122.35.207.22 > 64.231.199.91.59623: Flags [P.], seq 377292:377448, ack 181, win 501, length 156
21:44:12.431416 IP 134.122.35.207.22 > 64.231.199.91.59623: Flags [P.], seq 377448:377604, ack 181, win 501, length 156
21:44:12.431546 IP 134.122.35.207.22 > 64.231.199.91.59623: Flags [P.], seq 377604:377760, ack 181, win 501, length 156
21:44:12.431666 IP 134.122.35.207.22 > 64.231.199.91.59623: Flags [P.], seq 377760:377916, ack 181, win 501, length 156
21:44:12.431789 IP 134.122.35.207.22 > 64.231.199.91.59623: Flags [P.], seq 377916:378072, ack 181, win 501, length 156
21:44:12.431950 IP 134.122.35.207.22 > 64.231.199.91.59623: Flags [P.], seq 378072:378228, ack 181, win 501, length 156
21:44:12.432102 IP 134.122.35.207.22 > 64.231.199.91.59623: Flags [P.], seq 378228:378384, ack 181, win 501, length 156
21:44:12.432245 IP 64.231.199.91.59623 > 134.122.35.207.22: Flags [.], ack 365072, win 6295, length 0
21:44:12.432366 IP 134.122.35.207.22 > 64.231.199.91.59623: Flags [P.], seq 378384:378644, ack 181, win 501, length 260
21:44:12.432491 IP 134.122.35.207.22 > 64.231.199.91.59623: Flags [P.], seq 378644:378800, ack 181, win 501, length 156
21:44:12.432644 IP 134.122.35.207.22 > 64.231.199.91.59623: Flags [P.], seq 378800:378956, ack 181, win 501, length 156
21:44:12.432773 IP 134.122.35.207.22 > 64.231.199.91.59623: Flags [P.], seq 378956:379112, ack 181, win 501, length 156
21:44:12.432894 IP 134.122.35.207.22 > 64.231.199.91.59623: Flags [P.], seq 379112:379268, ack 181, win 501, length 156
21:44:12.432991 IP 64.231.199.91.59623 > 134.122.35.207.22: Flags [.], ack 365384, win 6294, length 0
21:44:12.433064 IP 134.122.35.207.22 > 64.231.199.91.59623: Flags [P.], seq 379268:379424, ack 181, win 501, length 156
21:44:12.433234 IP 134.122.35.207.22 > 64.231.199.91.59623: Flags [P.], seq 379424:379684, ack 181, win 501, length 260
21:44:12.433443 IP 134.122.35.207.22 > 64.231.199.91.59623: Flags [P.], seq 379684:379840, ack 181, win 501, length 156
21:44:12.433599 IP 134.122.35.207.22 > 64.231.199.91.59623: Flags [P.], seq 379840:379996, ack 181, win 501, length 156
21:44:12.433722 IP 134.122.35.207.22 > 64.231.199.91.59623: Flags [P.], seq 379996:380152, ack 181, win 501, length 156
21:44:12.433841 IP 134.122.35.207.22 > 64.231.199.91.59623: Flags [P.], seq 380152:380308, ack 181, win 501, length 156
21:44:12.434021 IP 134.122.35.207.22 > 64.231.199.91.59623: Flags [P.], seq 380308:380464, ack 181, win 501, length 156
21:44:12.434183 IP 134.122.35.207.22 > 64.231.199.91.59623: Flags [P.], seq 380464:380620, ack 181, win 501, length 156
21:44:12.434309 IP 134.122.35.207.22 > 64.231.199.91.59623: Flags [P.], seq 380620:380776, ack 181, win 501, length 156
21:44:12.434429 IP 134.122.35.207.22 > 64.231.199.91.59623: Flags [P.], seq 380776:380932, ack 181, win 501, length 156
21:44:12.434546 IP 134.122.35.207.22 > 64.231.199.91.59623: Flags [P.], seq 380932:381088, ack 181, win 501, length 156
21:44:12.434662 IP 134.122.35.207.22 > 64.231.199.91.59623: Flags [P.], seq 381088:381244, ack 181, win 501, length 156
21:44:12.434780 IP 134.122.35.207.22 > 64.231.199.91.59623: Flags [P.], seq 381244:381400, ack 181, win 501, length 156
21:44:12.434898 IP 134.122.35.207.22 > 64.231.199.91.59623: Flags [P.], seq 381400:381556, ack 181, win 501, length 156
21:44:12.434976 IP 64.231.199.91.59623 > 134.122.35.207.22: Flags [.], ack 366684, win 6295, length 0
21:44:12.435089 IP 134.122.35.207.22 > 64.231.199.91.59623: Flags [P.], seq 381556:381816, ack 181, win 501, length 260
21:44:12.435211 IP 134.122.35.207.22 > 64.231.199.91.59623: Flags [P.], seq 381816:381972, ack 181, win 501, length 156
21:44:12.435418 IP 134.122.35.207.22 > 64.231.199.91.59623: Flags [P.], seq 381972:382128, ack 181, win 501, length 156
21:44:12.435686 IP 134.122.35.207.22 > 64.231.199.91.59623: Flags [P.], seq 382128:382284, ack 181, win 501, length 156
21:44:12.435987 IP 134.122.35.207.22 > 64.231.199.91.59623: Flags [P.], seq 382284:382440, ack 181, win 501, length 156
21:44:12.436188 IP 134.122.35.207.22 > 64.231.199.91.59623: Flags [P.], seq 382440:382596, ack 181, win 501, length 156
21:44:12.436336 IP 134.122.35.207.22 > 64.231.199.91.59623: Flags [P.], seq 382596:382752, ack 181, win 501, length 156
21:44:12.436459 IP 134.122.35.207.22 > 64.231.199.91.59623: Flags [P.], seq 382752:382908, ack 181, win 501, length 156
21:44:12.436584 IP 134.122.35.207.22 > 64.231.199.91.59623: Flags [P.], seq 382908:383064, ack 181, win 501, length 156
21:44:12.436706 IP 134.122.35.207.22 > 64.231.199.91.59623: Flags [P.], seq 383064:383220, ack 181, win 501, length 156
21:44:12.436832 IP 134.122.35.207.22 > 64.231.199.91.59623: Flags [P.], seq 383220:383376, ack 181, win 501, length 156
21:44:12.436947 IP 134.122.35.207.22 > 64.231.199.91.59623: Flags [P.], seq 383376:383532, ack 181, win 501, length 156
21:44:12.438738 IP 64.231.199.91.59623 > 134.122.35.207.22: Flags [.], ack 368348, win 6295, length 0
21:44:12.438807 IP 134.122.35.207.22 > 64.231.199.91.59623: Flags [P.], seq 383532:383688, ack 181, win 501, length 156
21:44:12.438829 IP 64.231.199.91.59623 > 134.122.35.207.22: Flags [.], ack 370064, win 6295, length 0
21:44:12.439048 IP 134.122.35.207.22 > 64.231.199.91.59623: Flags [P.], seq 383688:384052, ack 181, win 501, length 364
21:44:12.439190 IP 134.122.35.207.22 > 64.231.199.91.59623: Flags [P.], seq 384052:384208, ack 181, win 501, length 156
21:44:12.439215 IP 64.231.199.91.59623 > 134.122.35.207.22: Flags [.], ack 371832, win 6295, length 0
21:44:12.439405 IP 134.122.35.207.22 > 64.231.199.91.59623: Flags [P.], seq 384208:384468, ack 181, win 501, length 260
21:44:12.439555 IP 134.122.35.207.22 > 64.231.199.91.59623: Flags [P.], seq 384468:384624, ack 181, win 501, length 156
21:44:12.439694 IP 134.122.35.207.22 > 64.231.199.91.59623: Flags [P.], seq 384624:384780, ack 181, win 501, length 156
21:44:12.439818 IP 134.122.35.207.22 > 64.231.199.91.59623: Flags [P.], seq 384780:384936, ack 181, win 501, length 156
21:44:12.440025 IP 134.122.35.207.22 > 64.231.199.91.59623: Flags [P.], seq 384936:385092, ack 181, win 501, length 156
21:44:12.440158 IP 134.122.35.207.22 > 64.231.199.91.59623: Flags [P.], seq 385092:385248, ack 181, win 501, length 156
21:44:12.440287 IP 134.122.35.207.22 > 64.231.199.91.59623: Flags [P.], seq 385248:385404, ack 181, win 501, length 156
21:44:12.440404 IP 134.122.35.207.22 > 64.231.199.91.59623: Flags [P.], seq 385404:385560, ack 181, win 501, length 156
21:44:12.440507 IP 64.231.199.91.59623 > 134.122.35.207.22: Flags [.], ack 373340, win 6295, length 0
21:44:12.440589 IP 134.122.35.207.22 > 64.231.199.91.59623: Flags [P.], seq 385560:385716, ack 181, win 501, length 156
21:44:12.440761 IP 134.122.35.207.22 > 64.231.199.91.59623: Flags [P.], seq 385716:385976, ack 181, win 501, length 260
21:44:12.440891 IP 134.122.35.207.22 > 64.231.199.91.59623: Flags [P.], seq 385976:386132, ack 181, win 501, length 156
21:44:12.441009 IP 134.122.35.207.22 > 64.231.199.91.59623: Flags [P.], seq 386132:386288, ack 181, win 501, length 156
21:44:12.441127 IP 134.122.35.207.22 > 64.231.199.91.59623: Flags [P.], seq 386288:386444, ack 181, win 501, length 156
21:44:12.441245 IP 134.122.35.207.22 > 64.231.199.91.59623: Flags [P.], seq 386444:386600, ack 181, win 501, length 156
21:44:12.441361 IP 134.122.35.207.22 > 64.231.199.91.59623: Flags [P.], seq 386600:386756, ack 181, win 501, length 156
21:44:12.441480 IP 134.122.35.207.22 > 64.231.199.91.59623: Flags [P.], seq 386756:386912, ack 181, win 501, length 156
21:44:12.441593 IP 134.122.35.207.22 > 64.231.199.91.59623: Flags [P.], seq 386912:387068, ack 181, win 501, length 156
21:44:12.441706 IP 134.122.35.207.22 > 64.231.199.91.59623: Flags [P.], seq 387068:387224, ack 181, win 501, length 156
21:44:12.441823 IP 134.122.35.207.22 > 64.231.199.91.59623: Flags [P.], seq 387224:387380, ack 181, win 501, length 156
21:44:12.441995 IP 134.122.35.207.22 > 64.231.199.91.59623: Flags [P.], seq 387380:387536, ack 181, win 501, length 156
21:44:12.442224 IP 64.231.199.91.59623 > 134.122.35.207.22: Flags [.], ack 375004, win 6295, length 0
21:44:12.442244 IP 134.122.35.207.22 > 64.231.199.91.59623: Flags [P.], seq 387536:387692, ack 181, win 501, length 156
21:44:12.442406 IP 134.122.35.207.22 > 64.231.199.91.59623: Flags [P.], seq 387692:387952, ack 181, win 501, length 260
21:44:12.442552 IP 134.122.35.207.22 > 64.231.199.91.59623: Flags [P.], seq 387952:388108, ack 181, win 501, length 156
21:44:12.442669 IP 134.122.35.207.22 > 64.231.199.91.59623: Flags [P.], seq 388108:388264, ack 181, win 501, length 156
21:44:12.442787 IP 134.122.35.207.22 > 64.231.199.91.59623: Flags [P.], seq 388264:388420, ack 181, win 501, length 156
21:44:12.442908 IP 134.122.35.207.22 > 64.231.199.91.59623: Flags [P.], seq 388420:388576, ack 181, win 501, length 156
21:44:12.443018 IP 134.122.35.207.22 > 64.231.199.91.59623: Flags [P.], seq 388576:388732, ack 181, win 501, length 156
21:44:12.443132 IP 134.122.35.207.22 > 64.231.199.91.59623: Flags [P.], seq 388732:388888, ack 181, win 501, length 156
21:44:12.443250 IP 134.122.35.207.22 > 64.231.199.91.59623: Flags [P.], seq 388888:389044, ack 181, win 501, length 156
21:44:12.443365 IP 134.122.35.207.22 > 64.231.199.91.59623: Flags [P.], seq 389044:389200, ack 181, win 501, length 156
21:44:12.443476 IP 134.122.35.207.22 > 64.231.199.91.59623: Flags [P.], seq 389200:389356, ack 181, win 501, length 156
21:44:12.443586 IP 134.122.35.207.22 > 64.231.199.91.59623: Flags [P.], seq 389356:389512, ack 181, win 501, length 156
21:44:12.443708 IP 134.122.35.207.22 > 64.231.199.91.59623: Flags [P.], seq 389512:389668, ack 181, win 501, length 156
21:44:12.443823 IP 134.122.35.207.22 > 64.231.199.91.59623: Flags [P.], seq 389668:389824, ack 181, win 501, length 156
21:44:12.444005 IP 134.122.35.207.22 > 64.231.199.91.59623: Flags [P.], seq 389824:389980, ack 181, win 501, length 156
21:44:12.444135 IP 134.122.35.207.22 > 64.231.199.91.59623: Flags [P.], seq 389980:390136, ack 181, win 501, length 156
21:44:12.444251 IP 134.122.35.207.22 > 64.231.199.91.59623: Flags [P.], seq 390136:390292, ack 181, win 501, length 156
21:44:12.444372 IP 134.122.35.207.22 > 64.231.199.91.59623: Flags [P.], seq 390292:390448, ack 181, win 501, length 156
21:44:12.444484 IP 134.122.35.207.22 > 64.231.199.91.59623: Flags [P.], seq 390448:390604, ack 181, win 501, length 156
21:44:12.444616 IP 134.122.35.207.22 > 64.231.199.91.59623: Flags [P.], seq 390604:390760, ack 181, win 501, length 156
21:44:12.444719 IP 64.231.199.91.59623 > 134.122.35.207.22: Flags [.], ack 377136, win 6295, length 0
21:44:12.444802 IP 134.122.35.207.22 > 64.231.199.91.59623: Flags [P.], seq 390760:390916, ack 181, win 501, length 156
21:44:12.444943 IP 134.122.35.207.22 > 64.231.199.91.59623: Flags [P.], seq 390916:391176, ack 181, win 501, length 260
21:44:12.445060 IP 134.122.35.207.22 > 64.231.199.91.59623: Flags [P.], seq 391176:391332, ack 181, win 501, length 156
21:44:12.445179 IP 64.231.199.91.59623 > 134.122.35.207.22: Flags [.], ack 378384, win 6290, length 0
21:44:12.445271 IP 134.122.35.207.22 > 64.231.199.91.59623: Flags [P.], seq 391332:391488, ack 181, win 501, length 156
21:44:12.445385 IP 134.122.35.207.22 > 64.231.199.91.59623: Flags [P.], seq 391488:391628, ack 181, win 501, length 140
21:44:12.445491 IP 134.122.35.207.22 > 64.231.199.91.59623: Flags [P.], seq 391628:391784, ack 181, win 501, length 156
21:44:12.445550 IP 134.122.35.207.22 > 64.231.199.91.59623: Flags [P.], seq 391784:391940, ack 181, win 501, length 156
21:44:12.445682 IP 134.122.35.207.22 > 64.231.199.91.59623: Flags [P.], seq 391940:392216, ack 181, win 501, length 276
21:44:12.445796 IP 134.122.35.207.22 > 64.231.199.91.59623: Flags [P.], seq 392216:392372, ack 181, win 501, length 156
21:44:12.445993 IP 134.122.35.207.22 > 64.231.199.91.59623: Flags [P.], seq 392372:392528, ack 181, win 501, length 156
21:44:12.446142 IP 134.122.35.207.22 > 64.231.199.91.59623: Flags [P.], seq 392528:392684, ack 181, win 501, length 156
21:44:12.446269 IP 134.122.35.207.22 > 64.231.199.91.59623: Flags [P.], seq 392684:392840, ack 181, win 501, length 156
21:44:12.446387 IP 134.122.35.207.22 > 64.231.199.91.59623: Flags [P.], seq 392840:392996, ack 181, win 501, length 156
21:44:12.446502 IP 134.122.35.207.22 > 64.231.199.91.59623: Flags [P.], seq 392996:393152, ack 181, win 501, length 156
21:44:12.446633 IP 134.122.35.207.22 > 64.231.199.91.59623: Flags [P.], seq 393152:393308, ack 181, win 501, length 156
21:44:12.446705 IP 64.231.199.91.59623 > 134.122.35.207.22: Flags [.], ack 379840, win 6295, length 0
21:44:12.446816 IP 134.122.35.207.22 > 64.231.199.91.59623: Flags [P.], seq 393308:393568, ack 181, win 501, length 260
21:44:12.446958 IP 134.122.35.207.22 > 64.231.199.91.59623: Flags [P.], seq 393568:393724, ack 181, win 501, length 156
21:44:12.447075 IP 134.122.35.207.22 > 64.231.199.91.59623: Flags [P.], seq 393724:393880, ack 181, win 501, length 156
21:44:12.447189 IP 134.122.35.207.22 > 64.231.199.91.59623: Flags [P.], seq 393880:394036, ack 181, win 501, length 156
21:44:12.447304 IP 134.122.35.207.22 > 64.231.199.91.59623: Flags [P.], seq 394036:394192, ack 181, win 501, length 156
21:44:12.447424 IP 134.122.35.207.22 > 64.231.199.91.59623: Flags [P.], seq 394192:394348, ack 181, win 501, length 156
21:44:12.447542 IP 134.122.35.207.22 > 64.231.199.91.59623: Flags [P.], seq 394348:394504, ack 181, win 501, length 156
21:44:12.447656 IP 134.122.35.207.22 > 64.231.199.91.59623: Flags [P.], seq 394504:394660, ack 181, win 501, length 156
21:44:12.447779 IP 134.122.35.207.22 > 64.231.199.91.59623: Flags [P.], seq 394660:394816, ack 181, win 501, length 156
21:44:12.447946 IP 134.122.35.207.22 > 64.231.199.91.59623: Flags [P.], seq 394816:394972, ack 181, win 501, length 156
21:44:12.448067 IP 134.122.35.207.22 > 64.231.199.91.59623: Flags [P.], seq 394972:395128, ack 181, win 501, length 156
21:44:12.448183 IP 134.122.35.207.22 > 64.231.199.91.59623: Flags [P.], seq 395128:395284, ack 181, win 501, length 156
21:44:12.448299 IP 134.122.35.207.22 > 64.231.199.91.59623: Flags [P.], seq 395284:395440, ack 181, win 501, length 156
21:44:12.448432 IP 134.122.35.207.22 > 64.231.199.91.59623: Flags [P.], seq 395440:395596, ack 181, win 501, length 156
21:44:12.448556 IP 134.122.35.207.22 > 64.231.199.91.59623: Flags [P.], seq 395596:395752, ack 181, win 501, length 156
21:44:12.448717 IP 64.231.199.91.59623 > 134.122.35.207.22: Flags [.], ack 381816, win 6295, length 0
21:44:12.448831 IP 134.122.35.207.22 > 64.231.199.91.59623: Flags [P.], seq 395752:395908, ack 181, win 501, length 156
21:44:12.449005 IP 134.122.35.207.22 > 64.231.199.91.59623: Flags [P.], seq 395908:396168, ack 181, win 501, length 260
21:44:12.449127 IP 134.122.35.207.22 > 64.231.199.91.59623: Flags [P.], seq 396168:396324, ack 181, win 501, length 156
21:44:12.449241 IP 134.122.35.207.22 > 64.231.199.91.59623: Flags [P.], seq 396324:396480, ack 181, win 501, length 156
21:44:12.449358 IP 134.122.35.207.22 > 64.231.199.91.59623: Flags [P.], seq 396480:396636, ack 181, win 501, length 156
21:44:12.449473 IP 134.122.35.207.22 > 64.231.199.91.59623: Flags [P.], seq 396636:396792, ack 181, win 501, length 156
21:44:12.449586 IP 134.122.35.207.22 > 64.231.199.91.59623: Flags [P.], seq 396792:396948, ack 181, win 501, length 156
21:44:12.449698 IP 134.122.35.207.22 > 64.231.199.91.59623: Flags [P.], seq 396948:397104, ack 181, win 501, length 156
21:44:12.449733 IP 64.231.199.91.59623 > 134.122.35.207.22: Flags [.], ack 383220, win 6290, length 0
21:44:12.449868 IP 134.122.35.207.22 > 64.231.199.91.59623: Flags [P.], seq 397104:397364, ack 181, win 501, length 260
21:44:12.450011 IP 134.122.35.207.22 > 64.231.199.91.59623: Flags [P.], seq 397364:397520, ack 181, win 501, length 156
21:44:12.450129 IP 134.122.35.207.22 > 64.231.199.91.59623: Flags [P.], seq 397520:397676, ack 181, win 501, length 156
21:44:12.450244 IP 134.122.35.207.22 > 64.231.199.91.59623: Flags [P.], seq 397676:397832, ack 181, win 501, length 156
21:44:12.450359 IP 134.122.35.207.22 > 64.231.199.91.59623: Flags [P.], seq 397832:397988, ack 181, win 501, length 156
21:44:12.450489 IP 134.122.35.207.22 > 64.231.199.91.59623: Flags [P.], seq 397988:398144, ack 181, win 501, length 156
21:44:12.450612 IP 134.122.35.207.22 > 64.231.199.91.59623: Flags [P.], seq 398144:398300, ack 181, win 501, length 156
21:44:12.450730 IP 134.122.35.207.22 > 64.231.199.91.59623: Flags [P.], seq 398300:398456, ack 181, win 501, length 156
21:44:12.450843 IP 134.122.35.207.22 > 64.231.199.91.59623: Flags [P.], seq 398456:398612, ack 181, win 501, length 156
21:44:12.450957 IP 134.122.35.207.22 > 64.231.199.91.59623: Flags [P.], seq 398612:398768, ack 181, win 501, length 156
21:44:12.450985 IP 64.231.199.91.59623 > 134.122.35.207.22: Flags [.], ack 383532, win 6295, length 0
21:44:12.451112 IP 134.122.35.207.22 > 64.231.199.91.59623: Flags [P.], seq 398768:399028, ack 181, win 501, length 260
21:44:12.451236 IP 134.122.35.207.22 > 64.231.199.91.59623: Flags [P.], seq 399028:399184, ack 181, win 501, length 156
21:44:12.451354 IP 134.122.35.207.22 > 64.231.199.91.59623: Flags [P.], seq 399184:399340, ack 181, win 501, length 156
21:44:12.451469 IP 134.122.35.207.22 > 64.231.199.91.59623: Flags [P.], seq 399340:399496, ack 181, win 501, length 156
21:44:12.451581 IP 134.122.35.207.22 > 64.231.199.91.59623: Flags [P.], seq 399496:399652, ack 181, win 501, length 156
21:44:12.451698 IP 134.122.35.207.22 > 64.231.199.91.59623: Flags [P.], seq 399652:399808, ack 181, win 501, length 156
21:44:12.451815 IP 134.122.35.207.22 > 64.231.199.91.59623: Flags [P.], seq 399808:399964, ack 181, win 501, length 156
21:44:12.452030 IP 134.122.35.207.22 > 64.231.199.91.59623: Flags [P.], seq 399964:400120, ack 181, win 501, length 156
21:44:12.452211 IP 134.122.35.207.22 > 64.231.199.91.59623: Flags [P.], seq 400120:400276, ack 181, win 501, length 156
21:44:12.452343 IP 134.122.35.207.22 > 64.231.199.91.59623: Flags [P.], seq 400276:400432, ack 181, win 501, length 156
21:44:12.452460 IP 134.122.35.207.22 > 64.231.199.91.59623: Flags [P.], seq 400432:400588, ack 181, win 501, length 156
21:44:12.453004 IP 64.231.199.91.59623 > 134.122.35.207.22: Flags [P.], seq 181:217, ack 383532, win 6295, length 36
21:44:12.453031 IP 64.231.199.91.59623 > 134.122.35.207.22: Flags [.], ack 384936, win 6290, length 0
21:44:12.453053 IP 134.122.35.207.22 > 64.231.199.91.59623: Flags [P.], seq 400588:400744, ack 217, win 501, length 156
21:44:12.453264 IP 134.122.35.207.22 > 64.231.199.91.59623: Flags [P.], seq 400744:401124, ack 217, win 501, length 380
21:44:12.453392 IP 134.122.35.207.22 > 64.231.199.91.59623: Flags [P.], seq 401124:401280, ack 217, win 501, length 156
21:44:12.453507 IP 134.122.35.207.22 > 64.231.199.91.59623: Flags [P.], seq 401280:401436, ack 217, win 501, length 156
21:44:12.453625 IP 134.122.35.207.22 > 64.231.199.91.59623: Flags [P.], seq 401436:401592, ack 217, win 501, length 156
21:44:12.453744 IP 134.122.35.207.22 > 64.231.199.91.59623: Flags [P.], seq 401592:401748, ack 217, win 501, length 156
21:44:12.453862 IP 134.122.35.207.22 > 64.231.199.91.59623: Flags [P.], seq 401748:401904, ack 217, win 501, length 156
21:44:12.453979 IP 134.122.35.207.22 > 64.231.199.91.59623: Flags [P.], seq 401904:402060, ack 217, win 501, length 156
21:44:12.454202 IP 64.231.199.91.59623 > 134.122.35.207.22: Flags [.], ack 386600, win 6295, length 0
21:44:12.454233 IP 134.122.35.207.22 > 64.231.199.91.59623: Flags [P.], seq 402060:402216, ack 217, win 501, length 156
21:44:12.454390 IP 134.122.35.207.22 > 64.231.199.91.59623: Flags [P.], seq 402216:402476, ack 217, win 501, length 260
21:44:12.454516 IP 134.122.35.207.22 > 64.231.199.91.59623: Flags [P.], seq 402476:402632, ack 217, win 501, length 156
21:44:12.454639 IP 134.122.35.207.22 > 64.231.199.91.59623: Flags [P.], seq 402632:402788, ack 217, win 501, length 156
21:44:12.454759 IP 134.122.35.207.22 > 64.231.199.91.59623: Flags [P.], seq 402788:402944, ack 217, win 501, length 156
21:44:12.454877 IP 134.122.35.207.22 > 64.231.199.91.59623: Flags [P.], seq 402944:403100, ack 217, win 501, length 156
21:44:12.454993 IP 134.122.35.207.22 > 64.231.199.91.59623: Flags [P.], seq 403100:403256, ack 217, win 501, length 156
21:44:12.455139 IP 134.122.35.207.22 > 64.231.199.91.59623: Flags [P.], seq 403256:403412, ack 217, win 501, length 156
21:44:12.455268 IP 134.122.35.207.22 > 64.231.199.91.59623: Flags [P.], seq 403412:403568, ack 217, win 501, length 156
21:44:12.455386 IP 134.122.35.207.22 > 64.231.199.91.59623: Flags [P.], seq 403568:403724, ack 217, win 501, length 156
21:44:12.455747 IP 64.231.199.91.59623 > 134.122.35.207.22: Flags [.], ack 388420, win 6295, length 0
21:44:12.455777 IP 134.122.35.207.22 > 64.231.199.91.59623: Flags [P.], seq 403724:403880, ack 217, win 501, length 156
21:44:12.455983 IP 134.122.35.207.22 > 64.231.199.91.59623: Flags [P.], seq 403880:404140, ack 217, win 501, length 260
21:44:12.456117 IP 134.122.35.207.22 > 64.231.199.91.59623: Flags [P.], seq 404140:404296, ack 217, win 501, length 156
21:44:12.456240 IP 134.122.35.207.22 > 64.231.199.91.59623: Flags [P.], seq 404296:404452, ack 217, win 501, length 156
21:44:12.456359 IP 134.122.35.207.22 > 64.231.199.91.59623: Flags [P.], seq 404452:404608, ack 217, win 501, length 156
21:44:12.456472 IP 134.122.35.207.22 > 64.231.199.91.59623: Flags [P.], seq 404608:404764, ack 217, win 501, length 156
21:44:12.456584 IP 134.122.35.207.22 > 64.231.199.91.59623: Flags [P.], seq 404764:404920, ack 217, win 501, length 156
21:44:12.456702 IP 134.122.35.207.22 > 64.231.199.91.59623: Flags [P.], seq 404920:405076, ack 217, win 501, length 156
21:44:12.456820 IP 134.122.35.207.22 > 64.231.199.91.59623: Flags [P.], seq 405076:405232, ack 217, win 501, length 156
21:44:12.456940 IP 134.122.35.207.22 > 64.231.199.91.59623: Flags [P.], seq 405232:405388, ack 217, win 501, length 156
21:44:12.457053 IP 134.122.35.207.22 > 64.231.199.91.59623: Flags [P.], seq 405388:405544, ack 217, win 501, length 156
21:44:12.457239 IP 64.231.199.91.59623 > 134.122.35.207.22: Flags [.], ack 390292, win 6295, length 0
21:44:12.457271 IP 134.122.35.207.22 > 64.231.199.91.59623: Flags [P.], seq 405544:405700, ack 217, win 501, length 156
21:44:12.457416 IP 134.122.35.207.22 > 64.231.199.91.59623: Flags [P.], seq 405700:405960, ack 217, win 501, length 260
21:44:12.457543 IP 134.122.35.207.22 > 64.231.199.91.59623: Flags [P.], seq 405960:406116, ack 217, win 501, length 156
21:44:12.457668 IP 134.122.35.207.22 > 64.231.199.91.59623: Flags [P.], seq 406116:406272, ack 217, win 501, length 156
21:44:12.457789 IP 134.122.35.207.22 > 64.231.199.91.59623: Flags [P.], seq 406272:406428, ack 217, win 501, length 156
21:44:12.457906 IP 134.122.35.207.22 > 64.231.199.91.59623: Flags [P.], seq 406428:406584, ack 217, win 501, length 156
21:44:12.458072 IP 134.122.35.207.22 > 64.231.199.91.59623: Flags [P.], seq 406584:406740, ack 217, win 501, length 156
21:44:12.458245 IP 134.122.35.207.22 > 64.231.199.91.59623: Flags [P.], seq 406740:406896, ack 217, win 501, length 156
21:44:12.458369 IP 134.122.35.207.22 > 64.231.199.91.59623: Flags [P.], seq 406896:407052, ack 217, win 501, length 156
21:44:12.458493 IP 134.122.35.207.22 > 64.231.199.91.59623: Flags [P.], seq 407052:407208, ack 217, win 501, length 156
21:44:12.458612 IP 134.122.35.207.22 > 64.231.199.91.59623: Flags [P.], seq 407208:407364, ack 217, win 501, length 156
21:44:12.458729 IP 134.122.35.207.22 > 64.231.199.91.59623: Flags [P.], seq 407364:407520, ack 217, win 501, length 156
21:44:12.459222 IP 64.231.199.91.59623 > 134.122.35.207.22: Flags [.], ack 392372, win 6295, length 0
21:44:12.459258 IP 134.122.35.207.22 > 64.231.199.91.59623: Flags [P.], seq 407520:407676, ack 217, win 501, length 156
21:44:12.459435 IP 134.122.35.207.22 > 64.231.199.91.59623: Flags [P.], seq 407676:407936, ack 217, win 501, length 260
21:44:12.459585 IP 134.122.35.207.22 > 64.231.199.91.59623: Flags [P.], seq 407936:408092, ack 217, win 501, length 156
21:44:12.459716 IP 134.122.35.207.22 > 64.231.199.91.59623: Flags [P.], seq 408092:408248, ack 217, win 501, length 156
21:44:12.459838 IP 134.122.35.207.22 > 64.231.199.91.59623: Flags [P.], seq 408248:408404, ack 217, win 501, length 156
21:44:12.460001 IP 64.231.199.91.59623 > 134.122.35.207.22: Flags [.], ack 394504, win 6295, length 0
21:44:12.460052 IP 134.122.35.207.22 > 64.231.199.91.59623: Flags [P.], seq 408404:408560, ack 217, win 501, length 156
21:44:12.460198 IP 134.122.35.207.22 > 64.231.199.91.59623: Flags [P.], seq 408560:408820, ack 217, win 501, length 260
21:44:12.460334 IP 134.122.35.207.22 > 64.231.199.91.59623: Flags [P.], seq 408820:408976, ack 217, win 501, length 156
21:44:12.460463 IP 134.122.35.207.22 > 64.231.199.91.59623: Flags [P.], seq 408976:409132, ack 217, win 501, length 156
21:44:12.460599 IP 134.122.35.207.22 > 64.231.199.91.59623: Flags [P.], seq 409132:409288, ack 217, win 501, length 156
21:44:12.460743 IP 134.122.35.207.22 > 64.231.199.91.59623: Flags [P.], seq 409288:409444, ack 217, win 501, length 156
21:44:12.460858 IP 134.122.35.207.22 > 64.231.199.91.59623: Flags [P.], seq 409444:409600, ack 217, win 501, length 156
21:44:12.460975 IP 134.122.35.207.22 > 64.231.199.91.59623: Flags [P.], seq 409600:409756, ack 217, win 501, length 156
21:44:12.461146 IP 134.122.35.207.22 > 64.231.199.91.59623: Flags [P.], seq 409756:409912, ack 217, win 501, length 156
21:44:12.461295 IP 134.122.35.207.22 > 64.231.199.91.59623: Flags [P.], seq 409912:410068, ack 217, win 501, length 156
21:44:12.461416 IP 134.122.35.207.22 > 64.231.199.91.59623: Flags [P.], seq 410068:410224, ack 217, win 501, length 156
21:44:12.461457 IP 64.231.199.91.59623 > 134.122.35.207.22: Flags [.], ack 395440, win 6292, length 0
21:44:12.461581 IP 134.122.35.207.22 > 64.231.199.91.59623: Flags [P.], seq 410224:410484, ack 217, win 501, length 260
21:44:12.461701 IP 134.122.35.207.22 > 64.231.199.91.59623: Flags [P.], seq 410484:410640, ack 217, win 501, length 156
21:44:12.461816 IP 134.122.35.207.22 > 64.231.199.91.59623: Flags [P.], seq 410640:410796, ack 217, win 501, length 156
21:44:12.461934 IP 134.122.35.207.22 > 64.231.199.91.59623: Flags [P.], seq 410796:410952, ack 217, win 501, length 156
21:44:12.462074 IP 134.122.35.207.22 > 64.231.199.91.59623: Flags [P.], seq 410952:411108, ack 217, win 501, length 156
21:44:12.462218 IP 134.122.35.207.22 > 64.231.199.91.59623: Flags [P.], seq 411108:411264, ack 217, win 501, length 156
21:44:12.462347 IP 134.122.35.207.22 > 64.231.199.91.59623: Flags [P.], seq 411264:411420, ack 217, win 501, length 156
21:44:12.462474 IP 134.122.35.207.22 > 64.231.199.91.59623: Flags [P.], seq 411420:411576, ack 217, win 501, length 156
21:44:12.462606 IP 134.122.35.207.22 > 64.231.199.91.59623: Flags [P.], seq 411576:411732, ack 217, win 501, length 156
21:44:12.462722 IP 134.122.35.207.22 > 64.231.199.91.59623: Flags [P.], seq 411732:411888, ack 217, win 501, length 156
21:44:12.462842 IP 134.122.35.207.22 > 64.231.199.91.59623: Flags [P.], seq 411888:412044, ack 217, win 501, length 156
21:44:12.462981 IP 134.122.35.207.22 > 64.231.199.91.59623: Flags [P.], seq 412044:412200, ack 217, win 501, length 156
21:44:12.463135 IP 134.122.35.207.22 > 64.231.199.91.59623: Flags [P.], seq 412200:412356, ack 217, win 501, length 156
21:44:12.463272 IP 134.122.35.207.22 > 64.231.199.91.59623: Flags [P.], seq 412356:412512, ack 217, win 501, length 156
21:44:12.463409 IP 134.122.35.207.22 > 64.231.199.91.59623: Flags [P.], seq 412512:412668, ack 217, win 501, length 156
21:44:12.463449 IP 64.231.199.91.59623 > 134.122.35.207.22: Flags [.], ack 398144, win 6295, length 0
21:44:12.463585 IP 134.122.35.207.22 > 64.231.199.91.59623: Flags [P.], seq 412668:412928, ack 217, win 501, length 260
21:44:12.463706 IP 134.122.35.207.22 > 64.231.199.91.59623: Flags [P.], seq 412928:413084, ack 217, win 501, length 156
21:44:12.463825 IP 134.122.35.207.22 > 64.231.199.91.59623: Flags [P.], seq 413084:413240, ack 217, win 501, length 156
21:44:12.464036 IP 134.122.35.207.22 > 64.231.199.91.59623: Flags [P.], seq 413240:413396, ack 217, win 501, length 156
21:44:12.464207 IP 134.122.35.207.22 > 64.231.199.91.59623: Flags [P.], seq 413396:413552, ack 217, win 501, length 156
21:44:12.464330 IP 134.122.35.207.22 > 64.231.199.91.59623: Flags [P.], seq 413552:413708, ack 217, win 501, length 156
21:44:12.464447 IP 134.122.35.207.22 > 64.231.199.91.59623: Flags [P.], seq 413708:413864, ack 217, win 501, length 156
21:44:12.464570 IP 134.122.35.207.22 > 64.231.199.91.59623: Flags [P.], seq 413864:414020, ack 217, win 501, length 156
21:44:12.464691 IP 134.122.35.207.22 > 64.231.199.91.59623: Flags [P.], seq 414020:414176, ack 217, win 501, length 156
21:44:12.464807 IP 134.122.35.207.22 > 64.231.199.91.59623: Flags [P.], seq 414176:414332, ack 217, win 501, length 156
21:44:12.464929 IP 134.122.35.207.22 > 64.231.199.91.59623: Flags [P.], seq 414332:414488, ack 217, win 501, length 156
21:44:12.465084 IP 134.122.35.207.22 > 64.231.199.91.59623: Flags [P.], seq 414488:414644, ack 217, win 501, length 156
21:44:12.465217 IP 134.122.35.207.22 > 64.231.199.91.59623: Flags [P.], seq 414644:414800, ack 217, win 501, length 156
21:44:12.465354 IP 134.122.35.207.22 > 64.231.199.91.59623: Flags [P.], seq 414800:414956, ack 217, win 501, length 156
21:44:12.465492 IP 134.122.35.207.22 > 64.231.199.91.59623: Flags [P.], seq 414956:415112, ack 217, win 501, length 156
21:44:12.465611 IP 134.122.35.207.22 > 64.231.199.91.59623: Flags [P.], seq 415112:415268, ack 217, win 501, length 156
21:44:12.465715 IP 64.231.199.91.59623 > 134.122.35.207.22: Flags [.], ack 400120, win 6295, length 0
21:44:12.465821 IP 134.122.35.207.22 > 64.231.199.91.59623: Flags [P.], seq 415268:415528, ack 217, win 501, length 260
21:44:12.465943 IP 134.122.35.207.22 > 64.231.199.91.59623: Flags [P.], seq 415528:415684, ack 217, win 501, length 156
21:44:12.466078 IP 134.122.35.207.22 > 64.231.199.91.59623: Flags [P.], seq 415684:415840, ack 217, win 501, length 156
21:44:12.466198 IP 64.231.199.91.59623 > 134.122.35.207.22: Flags [.], ack 401436, win 6290, length 0
21:44:12.466253 IP 134.122.35.207.22 > 64.231.199.91.59623: Flags [P.], seq 415840:415996, ack 217, win 501, length 156
21:44:12.466397 IP 134.122.35.207.22 > 64.231.199.91.59623: Flags [P.], seq 415996:416256, ack 217, win 501, length 260
21:44:12.466515 IP 134.122.35.207.22 > 64.231.199.91.59623: Flags [P.], seq 416256:416412, ack 217, win 501, length 156
21:44:12.466633 IP 134.122.35.207.22 > 64.231.199.91.59623: Flags [P.], seq 416412:416568, ack 217, win 501, length 156
21:44:12.466760 IP 134.122.35.207.22 > 64.231.199.91.59623: Flags [P.], seq 416568:416724, ack 217, win 501, length 156
21:44:12.466897 IP 134.122.35.207.22 > 64.231.199.91.59623: Flags [P.], seq 416724:416880, ack 217, win 501, length 156
21:44:12.467028 IP 134.122.35.207.22 > 64.231.199.91.59623: Flags [P.], seq 416880:417036, ack 217, win 501, length 156
21:44:12.467148 IP 134.122.35.207.22 > 64.231.199.91.59623: Flags [P.], seq 417036:417192, ack 217, win 501, length 156
21:44:12.467207 IP 64.231.199.91.59623 > 134.122.35.207.22: Flags [.], ack 402476, win 6295, length 0
21:44:12.467333 IP 134.122.35.207.22 > 64.231.199.91.59623: Flags [P.], seq 417192:417452, ack 217, win 501, length 260
21:44:12.467459 IP 134.122.35.207.22 > 64.231.199.91.59623: Flags [P.], seq 417452:417608, ack 217, win 501, length 156
21:44:12.467586 IP 134.122.35.207.22 > 64.231.199.91.59623: Flags [P.], seq 417608:417764, ack 217, win 501, length 156
21:44:12.467702 IP 134.122.35.207.22 > 64.231.199.91.59623: Flags [P.], seq 417764:417920, ack 217, win 501, length 156
21:44:12.467819 IP 134.122.35.207.22 > 64.231.199.91.59623: Flags [P.], seq 417920:418076, ack 217, win 501, length 156
21:44:12.467981 IP 134.122.35.207.22 > 64.231.199.91.59623: Flags [P.], seq 418076:418232, ack 217, win 501, length 156
21:44:12.468120 IP 134.122.35.207.22 > 64.231.199.91.59623: Flags [P.], seq 418232:418388, ack 217, win 501, length 156
21:44:12.468237 IP 134.122.35.207.22 > 64.231.199.91.59623: Flags [P.], seq 418388:418544, ack 217, win 501, length 156
21:44:12.468356 IP 134.122.35.207.22 > 64.231.199.91.59623: Flags [P.], seq 418544:418700, ack 217, win 501, length 156
21:44:12.468491 IP 134.122.35.207.22 > 64.231.199.91.59623: Flags [P.], seq 418700:418856, ack 217, win 501, length 156
21:44:12.468605 IP 134.122.35.207.22 > 64.231.199.91.59623: Flags [P.], seq 418856:419012, ack 217, win 501, length 156
21:44:12.468731 IP 134.122.35.207.22 > 64.231.199.91.59623: Flags [P.], seq 419012:419168, ack 217, win 501, length 156
21:44:12.468847 IP 134.122.35.207.22 > 64.231.199.91.59623: Flags [P.], seq 419168:419324, ack 217, win 501, length 156
21:44:12.468960 IP 134.122.35.207.22 > 64.231.199.91.59623: Flags [P.], seq 419324:419480, ack 217, win 501, length 156
21:44:12.469744 IP 64.231.199.91.59623 > 134.122.35.207.22: Flags [.], ack 405076, win 6295, length 0
21:44:12.469793 IP 134.122.35.207.22 > 64.231.199.91.59623: Flags [P.], seq 419480:419636, ack 217, win 501, length 156
21:44:12.469991 IP 134.122.35.207.22 > 64.231.199.91.59623: Flags [P.], seq 419636:419896, ack 217, win 501, length 260
21:44:12.470138 IP 134.122.35.207.22 > 64.231.199.91.59623: Flags [P.], seq 419896:420052, ack 217, win 501, length 156
21:44:12.470260 IP 134.122.35.207.22 > 64.231.199.91.59623: Flags [P.], seq 420052:420208, ack 217, win 501, length 156
21:44:12.470408 IP 134.122.35.207.22 > 64.231.199.91.59623: Flags [P.], seq 420208:420364, ack 217, win 501, length 156
21:44:12.470531 IP 134.122.35.207.22 > 64.231.199.91.59623: Flags [P.], seq 420364:420520, ack 217, win 501, length 156
21:44:12.470677 IP 134.122.35.207.22 > 64.231.199.91.59623: Flags [P.], seq 420520:420676, ack 217, win 501, length 156
21:44:12.470795 IP 134.122.35.207.22 > 64.231.199.91.59623: Flags [P.], seq 420676:420832, ack 217, win 501, length 156
21:44:12.470920 IP 134.122.35.207.22 > 64.231.199.91.59623: Flags [P.], seq 420832:420988, ack 217, win 501, length 156
21:44:12.471036 IP 134.122.35.207.22 > 64.231.199.91.59623: Flags [P.], seq 420988:421144, ack 217, win 501, length 156
21:44:12.471154 IP 134.122.35.207.22 > 64.231.199.91.59623: Flags [P.], seq 421144:421300, ack 217, win 501, length 156
21:44:12.471275 IP 134.122.35.207.22 > 64.231.199.91.59623: Flags [P.], seq 421300:421456, ack 217, win 501, length 156
21:44:12.471391 IP 134.122.35.207.22 > 64.231.199.91.59623: Flags [P.], seq 421456:421612, ack 217, win 501, length 156
21:44:12.471513 IP 134.122.35.207.22 > 64.231.199.91.59623: Flags [P.], seq 421612:421768, ack 217, win 501, length 156
21:44:12.471628 IP 134.122.35.207.22 > 64.231.199.91.59623: Flags [P.], seq 421768:421924, ack 217, win 501, length 156
21:44:12.471745 IP 134.122.35.207.22 > 64.231.199.91.59623: Flags [P.], seq 421924:422080, ack 217, win 501, length 156
21:44:12.472767 IP 64.231.199.91.59623 > 134.122.35.207.22: Flags [.], ack 408248, win 6295, length 0
21:44:12.472815 IP 134.122.35.207.22 > 64.231.199.91.59623: Flags [P.], seq 422080:422236, ack 217, win 501, length 156
21:44:12.473006 IP 134.122.35.207.22 > 64.231.199.91.59623: Flags [P.], seq 422236:422496, ack 217, win 501, length 260
21:44:12.473138 IP 134.122.35.207.22 > 64.231.199.91.59623: Flags [P.], seq 422496:422652, ack 217, win 501, length 156
21:44:12.473257 IP 134.122.35.207.22 > 64.231.199.91.59623: Flags [P.], seq 422652:422808, ack 217, win 501, length 156
21:44:12.473418 IP 134.122.35.207.22 > 64.231.199.91.59623: Flags [P.], seq 422808:422964, ack 217, win 501, length 156
21:44:12.473611 IP 134.122.35.207.22 > 64.231.199.91.59623: Flags [P.], seq 422964:423120, ack 217, win 501, length 156
21:44:12.473776 IP 134.122.35.207.22 > 64.231.199.91.59623: Flags [P.], seq 423120:423276, ack 217, win 501, length 156
21:44:12.473907 IP 134.122.35.207.22 > 64.231.199.91.59623: Flags [P.], seq 423276:423432, ack 217, win 501, length 156
21:44:12.474023 IP 134.122.35.207.22 > 64.231.199.91.59623: Flags [P.], seq 423432:423588, ack 217, win 501, length 156
21:44:12.474139 IP 134.122.35.207.22 > 64.231.199.91.59623: Flags [P.], seq 423588:423744, ack 217, win 501, length 156
21:44:12.474258 IP 134.122.35.207.22 > 64.231.199.91.59623: Flags [P.], seq 423744:423900, ack 217, win 501, length 156
21:44:12.474373 IP 134.122.35.207.22 > 64.231.199.91.59623: Flags [P.], seq 423900:424056, ack 217, win 501, length 156
21:44:12.474488 IP 134.122.35.207.22 > 64.231.199.91.59623: Flags [P.], seq 424056:424212, ack 217, win 501, length 156
21:44:12.474607 IP 134.122.35.207.22 > 64.231.199.91.59623: Flags [P.], seq 424212:424368, ack 217, win 501, length 156
21:44:12.474725 IP 134.122.35.207.22 > 64.231.199.91.59623: Flags [P.], seq 424368:424524, ack 217, win 501, length 156
21:44:12.474844 IP 134.122.35.207.22 > 64.231.199.91.59623: Flags [P.], seq 424524:424680, ack 217, win 501, length 156
21:44:12.474959 IP 134.122.35.207.22 > 64.231.199.91.59623: Flags [P.], seq 424680:424836, ack 217, win 501, length 156
21:44:12.475071 IP 134.122.35.207.22 > 64.231.199.91.59623: Flags [P.], seq 424836:424992, ack 217, win 501, length 156
21:44:12.475188 IP 134.122.35.207.22 > 64.231.199.91.59623: Flags [P.], seq 424992:425148, ack 217, win 501, length 156
21:44:12.475740 IP 64.231.199.91.59623 > 134.122.35.207.22: Flags [.], ack 410068, win 6295, length 0
21:44:12.475785 IP 134.122.35.207.22 > 64.231.199.91.59623: Flags [P.], seq 425148:425304, ack 217, win 501, length 156
21:44:12.476031 IP 134.122.35.207.22 > 64.231.199.91.59623: Flags [P.], seq 425304:425564, ack 217, win 501, length 260
21:44:12.476183 IP 64.231.199.91.59623 > 134.122.35.207.22: Flags [.], ack 411576, win 6295, length 0
21:44:12.476235 IP 134.122.35.207.22 > 64.231.199.91.59623: Flags [P.], seq 425564:425720, ack 217, win 501, length 156
21:44:12.476394 IP 134.122.35.207.22 > 64.231.199.91.59623: Flags [P.], seq 425720:425980, ack 217, win 501, length 260
21:44:12.476486 IP 64.231.199.91.59623 > 134.122.35.207.22: Flags [.], ack 413396, win 6295, length 0
21:44:12.476602 IP 134.122.35.207.22 > 64.231.199.91.59623: Flags [P.], seq 425980:426240, ack 217, win 501, length 260
21:44:12.476732 IP 134.122.35.207.22 > 64.231.199.91.59623: Flags [P.], seq 426240:426396, ack 217, win 501, length 156
21:44:12.476870 IP 134.122.35.207.22 > 64.231.199.91.59623: Flags [P.], seq 426396:426552, ack 217, win 501, length 156
21:44:12.477008 IP 134.122.35.207.22 > 64.231.199.91.59623: Flags [P.], seq 426552:426708, ack 217, win 501, length 156
21:44:12.477133 IP 134.122.35.207.22 > 64.231.199.91.59623: Flags [P.], seq 426708:426864, ack 217, win 501, length 156
21:44:12.477253 IP 134.122.35.207.22 > 64.231.199.91.59623: Flags [P.], seq 426864:427020, ack 217, win 501, length 156
21:44:12.477382 IP 134.122.35.207.22 > 64.231.199.91.59623: Flags [P.], seq 427020:427176, ack 217, win 501, length 156
21:44:12.477530 IP 134.122.35.207.22 > 64.231.199.91.59623: Flags [P.], seq 427176:427332, ack 217, win 501, length 156
21:44:12.477650 IP 134.122.35.207.22 > 64.231.199.91.59623: Flags [P.], seq 427332:427488, ack 217, win 501, length 156
21:44:12.477770 IP 134.122.35.207.22 > 64.231.199.91.59623: Flags [P.], seq 427488:427644, ack 217, win 501, length 156
21:44:12.477885 IP 134.122.35.207.22 > 64.231.199.91.59623: Flags [P.], seq 427644:427800, ack 217, win 501, length 156
21:44:12.477970 IP 64.231.199.91.59623 > 134.122.35.207.22: Flags [.], ack 415112, win 6295, length 0
21:44:12.478067 IP 134.122.35.207.22 > 64.231.199.91.59623: Flags [P.], seq 427800:428060, ack 217, win 501, length 260
21:44:12.478207 IP 134.122.35.207.22 > 64.231.199.91.59623: Flags [P.], seq 428060:428216, ack 217, win 501, length 156
21:44:12.478327 IP 134.122.35.207.22 > 64.231.199.91.59623: Flags [P.], seq 428216:428372, ack 217, win 501, length 156
21:44:12.478453 IP 134.122.35.207.22 > 64.231.199.91.59623: Flags [P.], seq 428372:428528, ack 217, win 501, length 156
21:44:12.478565 IP 134.122.35.207.22 > 64.231.199.91.59623: Flags [P.], seq 428528:428684, ack 217, win 501, length 156
21:44:12.478683 IP 134.122.35.207.22 > 64.231.199.91.59623: Flags [P.], seq 428684:428840, ack 217, win 501, length 156
21:44:12.478821 IP 134.122.35.207.22 > 64.231.199.91.59623: Flags [P.], seq 428840:428996, ack 217, win 501, length 156
21:44:12.478943 IP 134.122.35.207.22 > 64.231.199.91.59623: Flags [P.], seq 428996:429152, ack 217, win 501, length 156
21:44:12.479062 IP 134.122.35.207.22 > 64.231.199.91.59623: Flags [P.], seq 429152:429308, ack 217, win 501, length 156
21:44:12.479179 IP 134.122.35.207.22 > 64.231.199.91.59623: Flags [P.], seq 429308:429464, ack 217, win 501, length 156
21:44:12.479294 IP 134.122.35.207.22 > 64.231.199.91.59623: Flags [P.], seq 429464:429620, ack 217, win 501, length 156
21:44:12.479407 IP 134.122.35.207.22 > 64.231.199.91.59623: Flags [P.], seq 429620:429776, ack 217, win 501, length 156
21:44:12.479523 IP 134.122.35.207.22 > 64.231.199.91.59623: Flags [P.], seq 429776:429932, ack 217, win 501, length 156
21:44:12.479640 IP 134.122.35.207.22 > 64.231.199.91.59623: Flags [P.], seq 429932:430088, ack 217, win 501, length 156
21:44:12.479695 IP 64.231.199.91.59623 > 134.122.35.207.22: Flags [.], ack 416724, win 6295, length 0
21:44:12.479813 IP 134.122.35.207.22 > 64.231.199.91.59623: Flags [P.], seq 430088:430348, ack 217, win 501, length 260
21:44:12.479982 IP 134.122.35.207.22 > 64.231.199.91.59623: Flags [P.], seq 430348:430504, ack 217, win 501, length 156
21:44:12.480116 IP 134.122.35.207.22 > 64.231.199.91.59623: Flags [P.], seq 430504:430660, ack 217, win 501, length 156
21:44:12.480238 IP 134.122.35.207.22 > 64.231.199.91.59623: Flags [P.], seq 430660:430816, ack 217, win 501, length 156
21:44:12.480357 IP 134.122.35.207.22 > 64.231.199.91.59623: Flags [P.], seq 430816:430972, ack 217, win 501, length 156
21:44:12.480475 IP 134.122.35.207.22 > 64.231.199.91.59623: Flags [P.], seq 430972:431128, ack 217, win 501, length 156
21:44:12.480588 IP 134.122.35.207.22 > 64.231.199.91.59623: Flags [P.], seq 431128:431284, ack 217, win 501, length 156
21:44:12.480708 IP 134.122.35.207.22 > 64.231.199.91.59623: Flags [P.], seq 431284:431440, ack 217, win 501, length 156
21:44:12.480823 IP 134.122.35.207.22 > 64.231.199.91.59623: Flags [P.], seq 431440:431596, ack 217, win 501, length 156
21:44:12.480941 IP 134.122.35.207.22 > 64.231.199.91.59623: Flags [P.], seq 431596:431752, ack 217, win 501, length 156
21:44:12.481054 IP 134.122.35.207.22 > 64.231.199.91.59623: Flags [P.], seq 431752:431908, ack 217, win 501, length 156
21:44:12.481174 IP 134.122.35.207.22 > 64.231.199.91.59623: Flags [P.], seq 431908:432064, ack 217, win 501, length 156
21:44:12.481226 IP 64.231.199.91.59623 > 134.122.35.207.22: Flags [.], ack 418544, win 6295, length 0
21:44:12.481342 IP 134.122.35.207.22 > 64.231.199.91.59623: Flags [P.], seq 432064:432324, ack 217, win 501, length 260
21:44:12.481465 IP 134.122.35.207.22 > 64.231.199.91.59623: Flags [P.], seq 432324:432480, ack 217, win 501, length 156
21:44:12.481583 IP 134.122.35.207.22 > 64.231.199.91.59623: Flags [P.], seq 432480:432636, ack 217, win 501, length 156
21:44:12.481697 IP 134.122.35.207.22 > 64.231.199.91.59623: Flags [P.], seq 432636:432792, ack 217, win 501, length 156
21:44:12.481815 IP 134.122.35.207.22 > 64.231.199.91.59623: Flags [P.], seq 432792:432948, ack 217, win 501, length 156
21:44:12.481958 IP 134.122.35.207.22 > 64.231.199.91.59623: Flags [P.], seq 432948:433104, ack 217, win 501, length 156
21:44:12.482157 IP 134.122.35.207.22 > 64.231.199.91.59623: Flags [P.], seq 433104:433260, ack 217, win 501, length 156
21:44:12.482309 IP 134.122.35.207.22 > 64.231.199.91.59623: Flags [P.], seq 433260:433416, ack 217, win 501, length 156
21:44:12.482506 IP 134.122.35.207.22 > 64.231.199.91.59623: Flags [P.], seq 433416:433572, ack 217, win 501, length 156
21:44:12.482647 IP 134.122.35.207.22 > 64.231.199.91.59623: Flags [P.], seq 433572:433728, ack 217, win 501, length 156
21:44:12.482692 IP 64.231.199.91.59623 > 134.122.35.207.22: Flags [.], ack 419636, win 6291, length 0
21:44:12.482848 IP 134.122.35.207.22 > 64.231.199.91.59623: Flags [P.], seq 433728:433988, ack 217, win 501, length 260
21:44:12.483059 IP 134.122.35.207.22 > 64.231.199.91.59623: Flags [P.], seq 433988:434144, ack 217, win 501, length 156
21:44:12.483245 IP 134.122.35.207.22 > 64.231.199.91.59623: Flags [P.], seq 434144:434300, ack 217, win 501, length 156
21:44:12.483441 IP 134.122.35.207.22 > 64.231.199.91.59623: Flags [P.], seq 434300:434456, ack 217, win 501, length 156
21:44:12.483629 IP 134.122.35.207.22 > 64.231.199.91.59623: Flags [P.], seq 434456:434612, ack 217, win 501, length 156
21:44:12.483826 IP 134.122.35.207.22 > 64.231.199.91.59623: Flags [P.], seq 434612:434768, ack 217, win 501, length 156
21:44:12.484083 IP 134.122.35.207.22 > 64.231.199.91.59623: Flags [P.], seq 434768:434924, ack 217, win 501, length 156
21:44:12.484223 IP 64.231.199.91.59623 > 134.122.35.207.22: Flags [.], ack 421300, win 6295, length 0
21:44:12.484286 IP 134.122.35.207.22 > 64.231.199.91.59623: Flags [P.], seq 434924:435080, ack 217, win 501, length 156
21:44:12.484408 IP 134.122.35.207.22 > 64.231.199.91.59623: Flags [P.], seq 435080:435340, ack 217, win 501, length 260
21:44:12.484526 IP 134.122.35.207.22 > 64.231.199.91.59623: Flags [P.], seq 435340:435496, ack 217, win 501, length 156
21:44:12.484647 IP 134.122.35.207.22 > 64.231.199.91.59623: Flags [P.], seq 435496:435652, ack 217, win 501, length 156
21:44:12.484810 IP 134.122.35.207.22 > 64.231.199.91.59623: Flags [P.], seq 435652:435808, ack 217, win 501, length 156
21:44:12.484958 IP 134.122.35.207.22 > 64.231.199.91.59623: Flags [P.], seq 435808:435964, ack 217, win 501, length 156
21:44:12.485091 IP 134.122.35.207.22 > 64.231.199.91.59623: Flags [P.], seq 435964:436120, ack 217, win 501, length 156
21:44:12.485210 IP 134.122.35.207.22 > 64.231.199.91.59623: Flags [P.], seq 436120:436276, ack 217, win 501, length 156
21:44:12.485325 IP 134.122.35.207.22 > 64.231.199.91.59623: Flags [P.], seq 436276:436432, ack 217, win 501, length 156
21:44:12.485442 IP 134.122.35.207.22 > 64.231.199.91.59623: Flags [P.], seq 436432:436588, ack 217, win 501, length 156
21:44:12.485651 IP 134.122.35.207.22 > 64.231.199.91.59623: Flags [P.], seq 436588:436744, ack 217, win 501, length 156
21:44:12.485822 IP 134.122.35.207.22 > 64.231.199.91.59623: Flags [P.], seq 436744:436900, ack 217, win 501, length 156
21:44:12.485947 IP 134.122.35.207.22 > 64.231.199.91.59623: Flags [P.], seq 436900:437056, ack 217, win 501, length 156
21:44:12.485988 IP 64.231.199.91.59623 > 134.122.35.207.22: Flags [.], ack 421612, win 6294, length 0
21:44:12.486114 IP 134.122.35.207.22 > 64.231.199.91.59623: Flags [P.], seq 437056:437316, ack 217, win 501, length 260
21:44:12.486237 IP 134.122.35.207.22 > 64.231.199.91.59623: Flags [P.], seq 437316:437472, ack 217, win 501, length 156
21:44:12.486367 IP 134.122.35.207.22 > 64.231.199.91.59623: Flags [P.], seq 437472:437628, ack 217, win 501, length 156
21:44:12.486527 IP 64.231.199.91.59623 > 134.122.35.207.22: Flags [.], ack 422080, win 6292, length 0
21:44:12.486558 IP 134.122.35.207.22 > 64.231.199.91.59623: Flags [P.], seq 437628:437784, ack 217, win 501, length 156
21:44:12.486704 IP 134.122.35.207.22 > 64.231.199.91.59623: Flags [P.], seq 437784:438044, ack 217, win 501, length 260
21:44:12.486832 IP 134.122.35.207.22 > 64.231.199.91.59623: Flags [P.], seq 438044:438200, ack 217, win 501, length 156
21:44:12.486953 IP 134.122.35.207.22 > 64.231.199.91.59623: Flags [P.], seq 438200:438356, ack 217, win 501, length 156
21:44:12.487068 IP 134.122.35.207.22 > 64.231.199.91.59623: Flags [P.], seq 438356:438512, ack 217, win 501, length 156
21:44:12.487182 IP 134.122.35.207.22 > 64.231.199.91.59623: Flags [P.], seq 438512:438668, ack 217, win 501, length 156
21:44:12.487314 IP 134.122.35.207.22 > 64.231.199.91.59623: Flags [P.], seq 438668:438824, ack 217, win 501, length 156
21:44:12.487444 IP 134.122.35.207.22 > 64.231.199.91.59623: Flags [P.], seq 438824:438980, ack 217, win 501, length 156
21:44:12.487595 IP 134.122.35.207.22 > 64.231.199.91.59623: Flags [P.], seq 438980:439136, ack 217, win 501, length 156
21:44:12.487721 IP 134.122.35.207.22 > 64.231.199.91.59623: Flags [P.], seq 439136:439292, ack 217, win 501, length 156
21:44:12.490224 IP 64.231.199.91.59623 > 134.122.35.207.22: Flags [.], ack 425148, win 6295, length 0
21:44:12.490274 IP 134.122.35.207.22 > 64.231.199.91.59623: Flags [P.], seq 439292:439448, ack 217, win 501, length 156
21:44:12.490439 IP 64.231.199.91.59623 > 134.122.35.207.22: Flags [.], ack 426708, win 6295, length 0
21:44:12.490571 IP 134.122.35.207.22 > 64.231.199.91.59623: Flags [P.], seq 439448:439812, ack 217, win 501, length 364
21:44:12.490707 IP 134.122.35.207.22 > 64.231.199.91.59623: Flags [P.], seq 439812:439968, ack 217, win 501, length 156
21:44:12.490828 IP 134.122.35.207.22 > 64.231.199.91.59623: Flags [P.], seq 439968:440124, ack 217, win 501, length 156
21:44:12.490931 IP 64.231.199.91.59623 > 134.122.35.207.22: Flags [.], ack 428372, win 6295, length 0
21:44:12.490994 IP 134.122.35.207.22 > 64.231.199.91.59623: Flags [P.], seq 440124:440280, ack 217, win 501, length 156
21:44:12.491204 IP 134.122.35.207.22 > 64.231.199.91.59623: Flags [P.], seq 440280:440540, ack 217, win 501, length 260
21:44:12.491339 IP 134.122.35.207.22 > 64.231.199.91.59623: Flags [P.], seq 440540:440696, ack 217, win 501, length 156
21:44:12.491456 IP 134.122.35.207.22 > 64.231.199.91.59623: Flags [P.], seq 440696:440852, ack 217, win 501, length 156
21:44:12.491574 IP 134.122.35.207.22 > 64.231.199.91.59623: Flags [P.], seq 440852:441008, ack 217, win 501, length 156
21:44:12.491688 IP 134.122.35.207.22 > 64.231.199.91.59623: Flags [P.], seq 441008:441164, ack 217, win 501, length 156
21:44:12.491806 IP 134.122.35.207.22 > 64.231.199.91.59623: Flags [P.], seq 441164:441320, ack 217, win 501, length 156
21:44:12.492034 IP 134.122.35.207.22 > 64.231.199.91.59623: Flags [P.], seq 441320:441476, ack 217, win 501, length 156
21:44:12.492196 IP 134.122.35.207.22 > 64.231.199.91.59623: Flags [P.], seq 441476:441632, ack 217, win 501, length 156
21:44:12.492379 IP 134.122.35.207.22 > 64.231.199.91.59623: Flags [P.], seq 441632:441788, ack 217, win 501, length 156
21:44:12.492548 IP 134.122.35.207.22 > 64.231.199.91.59623: Flags [P.], seq 441788:441944, ack 217, win 501, length 156
21:44:12.492675 IP 134.122.35.207.22 > 64.231.199.91.59623: Flags [P.], seq 441944:442100, ack 217, win 501, length 156
21:44:12.492794 IP 134.122.35.207.22 > 64.231.199.91.59623: Flags [P.], seq 442100:442256, ack 217, win 501, length 156
21:44:12.492950 IP 134.122.35.207.22 > 64.231.199.91.59623: Flags [P.], seq 442256:442412, ack 217, win 501, length 156
21:44:12.493100 IP 134.122.35.207.22 > 64.231.199.91.59623: Flags [P.], seq 442412:442568, ack 217, win 501, length 156
21:44:12.493229 IP 134.122.35.207.22 > 64.231.199.91.59623: Flags [P.], seq 442568:442724, ack 217, win 501, length 156
21:44:12.493344 IP 134.122.35.207.22 > 64.231.199.91.59623: Flags [P.], seq 442724:442880, ack 217, win 501, length 156
21:44:12.493475 IP 134.122.35.207.22 > 64.231.199.91.59623: Flags [P.], seq 442880:443036, ack 217, win 501, length 156
21:44:12.493606 IP 134.122.35.207.22 > 64.231.199.91.59623: Flags [P.], seq 443036:443192, ack 217, win 501, length 156
21:44:12.493802 IP 134.122.35.207.22 > 64.231.199.91.59623: Flags [P.], seq 443192:443348, ack 217, win 501, length 156
21:44:12.493960 IP 134.122.35.207.22 > 64.231.199.91.59623: Flags [P.], seq 443348:443504, ack 217, win 501, length 156
21:44:12.494143 IP 134.122.35.207.22 > 64.231.199.91.59623: Flags [P.], seq 443504:443660, ack 217, win 501, length 156
21:44:12.494271 IP 134.122.35.207.22 > 64.231.199.91.59623: Flags [P.], seq 443660:443816, ack 217, win 501, length 156
21:44:12.494436 IP 134.122.35.207.22 > 64.231.199.91.59623: Flags [P.], seq 443816:443972, ack 217, win 501, length 156
21:44:12.494488 IP 64.231.199.91.59623 > 134.122.35.207.22: Flags [.], ack 430348, win 6295, length 0
21:44:12.494504 IP 64.231.199.91.59623 > 134.122.35.207.22: Flags [P.], seq 217:253, ack 430348, win 6295, length 36
21:44:12.494513 IP 64.231.199.91.59623 > 134.122.35.207.22: Flags [.], ack 432064, win 6295, length 0
^C
2931 packets captured
2933 packets received by filter
0 packets dropped by kernel