31960:1732164, ack 973, win 501, length 204
21:47:57.625540 IP 134.122.35.207.ssh > bras-base-toroon2634w-grc-08-64-231-199-91.dsl.bell.ca.59623: Flags [P.], seq 1732164:1732368, ack 973, win 501, length 204
21:47:57.625655 IP 134.122.35.207.ssh > bras-base-toroon2634w-grc-08-64-231-199-91.dsl.bell.ca.59623: Flags [P.], seq 1732368:1732572, ack 973, win 501, length 204
21:47:57.625761 IP 134.122.35.207.ssh > bras-base-toroon2634w-grc-08-64-231-199-91.dsl.bell.ca.59623: Flags [P.], seq 1732572:1732776, ack 973, win 501, length 204
21:47:57.625871 IP 134.122.35.207.ssh > bras-base-toroon2634w-grc-08-64-231-199-91.dsl.bell.ca.59623: Flags [P.], seq 1732776:1732980, ack 973, win 501, length 204
21:47:57.625975 IP 134.122.35.207.ssh > bras-base-toroon2634w-grc-08-64-231-199-91.dsl.bell.ca.59623: Flags [P.], seq 1732980:1733184, ack 973, win 501, length 204
21:47:57.626074 IP 134.122.35.207.ssh > bras-base-toroon2634w-grc-08-64-231-199-91.dsl.bell.ca.59623: Flags [P.], seq 1733184:1733388, ack 973, win 501, length 204
21:47:57.626175 IP 134.122.35.207.ssh > bras-base-toroon2634w-grc-08-64-231-199-91.dsl.bell.ca.59623: Flags [P.], seq 1733388:1733592, ack 973, win 501, length 204
21:47:57.626272 IP 134.122.35.207.ssh > bras-base-toroon2634w-grc-08-64-231-199-91.dsl.bell.ca.59623: Flags [P.], seq 1733592:1733796, ack 973, win 501, length 204
21:47:57.626372 IP 134.122.35.207.ssh > bras-base-toroon2634w-grc-08-64-231-199-91.dsl.bell.ca.59623: Flags [P.], seq 1733796:1734000, ack 973, win 501, length 204
21:47:57.626475 IP 134.122.35.207.ssh > bras-base-toroon2634w-grc-08-64-231-199-91.dsl.bell.ca.59623: Flags [P.], seq 1734000:1734204, ack 973, win 501, length 204
21:47:57.626575 IP 134.122.35.207.ssh > bras-base-toroon2634w-grc-08-64-231-199-91.dsl.bell.ca.59623: Flags [P.], seq 1734204:1734408, ack 973, win 501, length 204
21:47:57.626671 IP 134.122.35.207.ssh > bras-base-toroon2634w-grc-08-64-231-199-91.dsl.bell.ca.59623: Flags [P.], seq 1734408:1734612, ack 973, win 501, length 204
21:47:57.626772 IP 134.122.35.207.ssh > bras-base-toroon2634w-grc-08-64-231-199-91.dsl.bell.ca.59623: Flags [P.], seq 1734612:1734816, ack 973, win 501, length 204
21:47:57.626866 IP 134.122.35.207.ssh > bras-base-toroon2634w-grc-08-64-231-199-91.dsl.bell.ca.59623: Flags [P.], seq 1734816:1735020, ack 973, win 501, length 204
21:47:57.626962 IP 134.122.35.207.ssh > bras-base-toroon2634w-grc-08-64-231-199-91.dsl.bell.ca.59623: Flags [P.], seq 1735020:1735224, ack 973, win 501, length 204
21:47:57.627069 IP 134.122.35.207.ssh > bras-base-toroon2634w-grc-08-64-231-199-91.dsl.bell.ca.59623: Flags [P.], seq 1735224:1735428, ack 973, win 501, length 204
21:47:57.627170 IP 134.122.35.207.ssh > bras-base-toroon2634w-grc-08-64-231-199-91.dsl.bell.ca.59623: Flags [P.], seq 1735428:1735632, ack 973, win 501, length 204
21:47:57.627278 IP 134.122.35.207.ssh > bras-base-toroon2634w-grc-08-64-231-199-91.dsl.bell.ca.59623: Flags [P.], seq 1735632:1735836, ack 973, win 501, length 204
21:47:57.627384 IP 134.122.35.207.ssh > bras-base-toroon2634w-grc-08-64-231-199-91.dsl.bell.ca.59623: Flags [P.], seq 1735836:1736040, ack 973, win 501, length 204
21:47:57.627479 IP 134.122.35.207.ssh > bras-base-toroon2634w-grc-08-64-231-199-91.dsl.bell.ca.59623: Flags [P.], seq 1736040:1736244, ack 973, win 501, length 204
21:47:57.627618 IP 134.122.35.207.ssh > bras-base-toroon2634w-grc-08-64-231-199-91.dsl.bell.ca.59623: Flags [P.], seq 1736244:1736448, ack 973, win 501, length 204
21:47:57.627724 IP 134.122.35.207.ssh > bras-base-toroon2634w-grc-08-64-231-199-91.dsl.bell.ca.59623: Flags [P.], seq 1736448:1736652, ack 973, win 501, length 204
21:47:57.627856 IP 134.122.35.207.ssh > bras-base-toroon2634w-grc-08-64-231-199-91.dsl.bell.ca.59623: Flags [P.], seq 1736652:1736856, ack 973, win 501, length 204
21:47:57.627977 IP 134.122.35.207.ssh > bras-base-toroon2634w-grc-08-64-231-199-91.dsl.bell.ca.59623: Flags [P.], seq 1736856:1737060, ack 973, win 501, length 204